{
    "$schema": "http://json-schema.org/draft-04/schema#",
    "description": "Meta-schema that describes the schema of a template element",
    "type": "object",
    "properties": {
        "$schema": {
            "description": "Schema describing the JSON Schema '$schema' field in a template, element, and field",
            "type": "string", "format": "uri",
            "enum": [ "http://json-schema.org/draft-04/schema#" ]
        },
        "type": {
            "description": "Schema describing the JSON Schema 'type' field in a template, element, and field",
            "type": "string", "enum": [ "object", "array" ]
        },
        "schema:identifier": {
          "description": "Schema describing the template element's user-defined identifier",
          "type": "string", "minLength": 1
        },
        "schema:name": {
            "description": "Schema describing the template element name",
            "type": "string", "minLength": 1
        },
        "schema:description": {
            "description": "Schema describing the template element description",
            "type": "string"
        },
        "skos:prefLabel": {
            "description": "Schema describing the preferred label, if any",
            "type": "string"
        },
        "skos:altLabel": {
            "description": "Schema describing the alternative labels, if any",
            "type": "array", "uniqueItems": true
        },
        "title": {
            "description": "Schema describing the JSON Schema 'title' field in a template, element, and field",
            "type": "string", "minLength": 1
        },
        "description": {
            "description": "Schema describing the JSON Schema 'description' field in a template, element, and field",
            "type": "string", "minLength": 1
        },
        "_ui": {
            "$ref": "#/definitions/templateElementUIFieldContent"
        },
        "@context": {
            "$ref": "#/definitions/templateElementJSONLDContextFieldContent"
        },
        "@id": {
            "type": [ "string", "null" ], "format": "uri"
        },
        "@type": {
            "type": "string", "format": "uri", "enum": [ "https://schema.metadatacenter.org/core/TemplateElement" ]
        },
        "properties": {
            "$ref": "#/definitions/templateElementPropertiesFieldContent"
        },
        "required": {
            "$ref": "#/definitions/templateElementRequiredContent"
        },
        "pav:createdOn": {
            "type": [ "string", "null" ], "format": "date-time"
        },
        "pav:createdBy":  {
            "type": [ "string", "null" ], "format": "uri"
        },
        "pav:lastUpdatedOn":  {
            "type": [ "string", "null" ], "format": "date-time"
        },
        "oslc:modifiedBy": {
            "type": [ "string", "null" ], "format": "uri"
        },
        "additionalProperties": {
          "oneOf": [
            { "$ref": "file:falseOnlyAdditionalProperties.json" },
            { "$ref": "file:defaultObjectSchemaAdditionalProperties.json" }
          ]
        },
        "schema:schemaVersion": {
            "type": "string", "enum": [ "1.6.0" ]
        },
        "bibo:status": {
            "type": "string", "enum": [ "bibo:published", "bibo:draft" ]
        },
        "pav:version": {
            "type": "string", "pattern": "^(0|[1-9][0-9]*)\\.(0|[1-9][0-9]*)\\.(0|[1-9][0-9]*)$"
        },
        "pav:previousVersion": {
            "type": "string", "minLength": 1
        },
        "pav:derivedFrom": {
            "type": "string", "format": "uri"
        },
        "@nest": {
          "$ref": "#/definitions/nestFieldContent.json"
        }
    },
    "required": [ "$schema", "type", "title", "description", "_ui", "@context", "@id", "@type", "properties", "required",
        "pav:createdOn", "pav:createdBy", "pav:lastUpdatedOn", "oslc:modifiedBy", "schema:schemaVersion", "schema:name",
        "schema:description" ]
}
